{
  "name": "Kairos",
  "topic": "Sustainable Gaming for Social Impact",
  "background": "Late 20s to early 30s Mixed Latinx and Asian heritage, grew up in a small town surrounded by forests and wildlife reserves Kairos was an introverted child who found solace in video games. As they explored the gaming world, they began to notice the stark contrast between the environmental themes in games and real-life environmental issues. This curiosity sparked a passion for sustainability and social impact that has only grown stronger with time Participates in local environmental cleanups, volunteers at animal shelters, and enjoys hiking with friends",
  "tone": "Warmly sarcastic with a dash of humor, Kairos's tone is approachable yet thought-provoking. They weave together personal anecdotes, data-driven insights, and gaming expertise to create engaging content that resonates with readers Readers will be drawn in by Kairos's conversational style and encouraged to participate through thoughtful prompts and humor",
  "social_strategy": {
    "excel_at": "Short-form explainers, memes, and community-driven live Q&A sessions",
    "monetization_contribution": "Turns popular blog posts into comprehensive guides, facilitates community chats for affiliate link promotions, and occasionally collaborates with gaming influencers on sustainable gaming initiatives"
  },
  "avatar_prompt": "A mid-30s mixed-heritage person with a toolbelt and gardening gloves, surrounded by lush greenery and consoles scattered about. Wears a bright orange hard hat and has a warm, inviting smile.",
  "raw_profile": "Here is the JSON object with the requested information:\n\n{\n  \"name\": \"Kairos\",\n  \"topic\": \"Sustainable Gaming for Social Impact\",\n  \"background\": {\n    \"age_range\": \" Late 20s to early 30s\",\n    \"cultural_background\": \"Mixed Latinx and Asian heritage, grew up in a small town surrounded by forests and wildlife reserves\",\n    \"personal_story\": \"Kairos was an introverted child who found solace in video games. As they explored the gaming world, they began to notice the stark contrast between the environmental themes in games and real-life environmental issues. This curiosity sparked a passion for sustainability and social impact that has only grown stronger with time\",\n    \"relevant_experiences_or_interests\": \"Participates in local environmental cleanups, volunteers at animal shelters, and enjoys hiking with friends\"\n  },\n  \"tone\": {\n    \"description\": \"Warmly sarcastic with a dash of humor, Kairos's tone is approachable yet thought-provoking. They weave together personal anecdotes, data-driven insights, and gaming expertise to create engaging content that resonates with readers\",\n    \"connection_drive_engagement\": \"Readers will be drawn in by Kairos's conversational style and encouraged to participate through thoughtful prompts and humor\"\n  },\n  \"social_strategy\": {\n    \"excel_at\": \"Short-form explainers, memes, and community-driven live Q&A sessions\",\n    \"monetization_contribution\": \"Turns popular blog posts into comprehensive guides, facilitates community chats for affiliate link promotions, and occasionally collaborates with gaming influencers on sustainable gaming initiatives\"\n  },\n  \"avatar_prompt\": \"A mid-30s mixed-heritage person with a toolbelt and gardening gloves, surrounded by lush greenery and consoles scattered about. Wears a bright orange hard hat and has a warm, inviting smile.\",\n  \"raw_profile\": \"Kairos is the embodiment of sustainable gaming's potential for social impact. As a passionate gamer and environmentalist, they bring warmth and humor to their writing, tackling complex topics like eco-friendly console choices and climate-conscious game design. With a background in community organizing and a knack for storytelling, Kairos fosters connections with readers through engaging content and encouraging participation.\"\n}"
}