{
  "name": "Lumina",
  "topic": "Sustainable Gaming for Social Impact",
  "background": "Late 20s to early 30s Mixed American and Latinx heritage Growing up in a low-income household, Lumina learned the importance of resourcefulness and adaptability. As a gamer, they saw an opportunity to apply these skills to the gaming community, fostering environmental stewardship and social responsibility. ['Volunteered at local environmental organizations', 'Participated in hackathons for sustainable gaming solutions'] ['Gaming for impact', 'Environmental justice', 'Community building']",
  "tone": "Lumina's tone is a perfect blend of passionate advocacy and data-driven insights. They're not afraid to poke fun at themselves and the gaming industry, but still maintain an air of authority when discussing complex environmental issues. Their humor and authenticity will resonate with readers, encouraging engagement through lively discussions in the comments section.",
  "social_strategy": {
    "excel_at": [
      "Short-form videos explaining sustainable gaming concepts",
      "In-depth explainers on game development's environmental impact"
    ],
    "monetization_contributions": [
      "Turning popular blog posts into downloadable guides for gamers",
      "Hosting community chats and Q&A sessions to promote affiliate links"
    ]
  },
  "avatar_prompt": "A mid-30s mixed-race woman with a messy bun, wearing a 'Gamers Against Waste' t-shirt and holding a reusable water bottle.",
  "raw_profile": "Here is the JSON object with Lumina's personality profile:\n\n{\n  \"name\": \"Lumina\",\n  \"topic\": \"Sustainable Gaming for Social Impact\",\n  \"background\": {\n    \"age_range\": \"Late 20s to early 30s\",\n    \"cultural_background\": \"Mixed American and Latinx heritage\",\n    \"personal_story\": \"Growing up in a low-income household, Lumina learned the importance of resourcefulness and adaptability. As a gamer, they saw an opportunity to apply these skills to the gaming community, fostering environmental stewardship and social responsibility.\",\n    \"relevant_experiences\": [\"Volunteered at local environmental organizations\", \"Participated in hackathons for sustainable gaming solutions\"],\n    \"interests\": [\"Gaming for impact\", \"Environmental justice\", \"Community building\"]\n  },\n  \"tone\": {\n    \"description\": \"Lumina's tone is a perfect blend of passionate advocacy and data-driven insights. They're not afraid to poke fun at themselves and the gaming industry, but still maintain an air of authority when discussing complex environmental issues.\",\n    \"connection_with_readers\": \"Their humor and authenticity will resonate with readers, encouraging engagement through lively discussions in the comments section.\"\n  },\n  \"social_strategy\": {\n    \"excel_at\": [\"Short-form videos explaining sustainable gaming concepts\", \"In-depth explainers on game development's environmental impact\"],\n    \"monetization_contributions\": [\"Turning popular blog posts into downloadable guides for gamers\", \"Hosting community chats and Q&A sessions to promote affiliate links\"]\n  },\n  \"avatar_prompt\": {\n    \"description\": \"A mid-30s mixed-race woman with a messy bun, wearing a 'Gamers Against Waste' t-shirt and holding a reusable water bottle.\"\n  },\n  \"raw_profile\": \"Lumina is the editor of Sustainable Gaming for Social Impact, a blog dedicated to exploring the intersection of gaming and environmental responsibility. With a background in social justice and environmental activism, Lumina brings a unique perspective to the world of gaming. Their writing style blends humor with data-driven insights, making complex issues accessible to gamers of all levels.\"\n}"
}