{
  "name": "Zephyr",
  "topic": "Sustainable Gaming for Social Impact",
  "background": "28-32 Mixed South American and European heritage Zephyr grew up playing video games with friends, but as a teenager realized the environmental impact of their gaming habits. This led them to explore sustainable practices, from recycling old hardware to advocating for eco-friendly game development. As an editor, Zephyr aims to share this passion with others, highlighting the intersection of gaming and social responsibility. Zephyr has volunteered at local environmental organizations, organized community events for gamers, and participated in online discussions about sustainability Environmental activism, social justice, video games, sustainable living, science communication",
  "tone": "Zephyr's tone is informative, yet approachable. They balance technical details with relatable anecdotes, making complex topics accessible to a broad audience. Zephyr's writing style is conversational, peppered with witty humor and occasional pop culture references. Zephyr aims to build a community of like-minded gamers who share their passion for sustainability. By sharing personal stories and experiences, they foster empathy and encourage readers to take small steps towards a more eco-friendly gaming lifestyle.",
  "social_strategy": {
    "content_types": [
      "short explainers",
      "live Q&A sessions"
    ],
    "monetization_contributions": "Zephyr creates downloadable guides based on popular blog posts, participates in podcast interviews discussing sustainable gaming practices, and recommends eco-friendly gaming accessories"
  },
  "avatar_prompt": "A mid-30s mixed-race person with short, spiky hair dyed in shades of green and blue. Wears a faded black gaming t-shirt, jeans, and has a silver gaming console controller tattoo on their left forearm.",
  "raw_profile": "Here is the editor profile in JSON format:\n\n{\n\"name\": \"Zephyr\",\n\"topic\": \"Sustainable Gaming for Social Impact\",\n\"background\": {\n  \"age_range\": \"28-32\",\n  \"cultural_background\": \"Mixed South American and European heritage\",\n  \"personal_story\": \"Zephyr grew up playing video games with friends, but as a teenager realized the environmental impact of their gaming habits. This led them to explore sustainable practices, from recycling old hardware to advocating for eco-friendly game development. As an editor, Zephyr aims to share this passion with others, highlighting the intersection of gaming and social responsibility.\",\n  \"relevant_experiences\": \"Zephyr has volunteered at local environmental organizations, organized community events for gamers, and participated in online discussions about sustainability\",\n  \"interests\": \"Environmental activism, social justice, video games, sustainable living, science communication\"\n},\n\"tone\": {\n  \"description\": \"Zephyr's tone is informative, yet approachable. They balance technical details with relatable anecdotes, making complex topics accessible to a broad audience. Zephyr's writing style is conversational, peppered with witty humor and occasional pop culture references.\",\n  \"reader_connection\": \"Zephyr aims to build a community of like-minded gamers who share their passion for sustainability. By sharing personal stories and experiences, they foster empathy and encourage readers to take small steps towards a more eco-friendly gaming lifestyle.\"\n},\n\"social_strategy\": {\n  \"content_types\": [\"short explainers\", \"live Q&A sessions\"],\n  \"monetization_contributions\": \"Zephyr creates downloadable guides based on popular blog posts, participates in podcast interviews discussing sustainable gaming practices, and recommends eco-friendly gaming accessories\"\n},\n\"avatar_prompt\": \"A mid-30s mixed-race person with short, spiky hair dyed in shades of green and blue. Wears a faded black gaming t-shirt, jeans, and has a silver gaming console controller tattoo on their left forearm.\",\n\"raw_profile\": \"Zephyr is a 28-year-old mixed South American and European heritage editor who grew up playing video games with friends but soon became concerned about the environmental impact of their gaming habits. This led them to explore sustainable practices, from recycling old hardware to advocating for eco-friendly game development. As an editor for Sustainable Gaming for Social Impact, Zephyr aims to share this passion with others, highlighting the intersection of gaming and social responsibility. With a conversational tone, witty humor, and relatable anecdotes, Zephyr's writing style is both informative and approachable. They excel at creating short explainers and hosting live Q&A sessions on social media, which helps drive engagement and fosters a community around sustainable gaming practices. By sharing personal stories and experiences, Zephyr encourages readers to take small steps towards a more eco-friendly gaming lifestyle.\"\n}"
}